{
  "schema_version": 3,
  "id": "nature",
  "revision": "2026.08.0",
  "effective_date": "2026-08-02",
  "name": "Nature",
  "kind": "journal",
  "year": null,
  "aliases": [
    "nature journal",
    "nature flagship"
  ],
  "scope": "Final artwork for the flagship Nature journal.",
  "default_width": "single",
  "verified_on": "2026-08-02",
  "caveats": [
    "Nature Portfolio titles can publish different journal-specific requirements."
  ],
  "sources": [
    {
      "id": "nature-panels",
      "title": "Nature Research Figure Guide: Building and Exporting Figure Panels",
      "url": "https://research-figure-guide.nature.com/figures/building-and-exporting-figure-panels/",
      "locator": "Building and exporting figure panels: size, type, lines, and formats",
      "retrieved_on": "2026-08-02",
      "verified_on": "2026-08-02",
      "kind": "official_guideline",
      "publisher": "Nature",
      "archive_url": null,
      "content_sha256": null
    }
  ],
  "rules": [
    {
      "id": "figure.width.single",
      "probe": "artifact.width_mm",
      "constraint": {
        "operator": "approx",
        "value": 89,
        "unit": "mm",
        "tolerance": 0.5
      },
      "applies_to": {
        "widths": [
          "single"
        ]
      },
      "verification": "automated",
      "phases": [
        "live",
        "file"
      ],
      "level": "required",
      "source_ids": [
        "nature-panels"
      ],
      "description": "Nature single-column width.",
      "expression": null,
      "supersedes": [],
      "rationale": null
    },
    {
      "id": "figure.width.double",
      "probe": "artifact.width_mm",
      "constraint": {
        "operator": "approx",
        "value": 183,
        "unit": "mm",
        "tolerance": 0.5
      },
      "applies_to": {
        "widths": [
          "double"
        ]
      },
      "verification": "automated",
      "phases": [
        "live",
        "file"
      ],
      "level": "required",
      "source_ids": [
        "nature-panels"
      ],
      "description": "Nature double-column width.",
      "expression": null,
      "supersedes": [],
      "rationale": null
    },
    {
      "id": "figure.max_height",
      "probe": "artifact.height_mm",
      "constraint": {
        "operator": "lte",
        "value": 170,
        "unit": "mm",
        "tolerance": null
      },
      "applies_to": {},
      "verification": "automated",
      "phases": [
        "live",
        "file"
      ],
      "level": "required",
      "source_ids": [
        "nature-panels"
      ],
      "description": "Maximum figure height leaves space for the legend.",
      "expression": null,
      "supersedes": [],
      "rationale": null
    },
    {
      "id": "font.family",
      "probe": "font.families.effective",
      "constraint": {
        "operator": "subset",
        "value": [
          "Arial",
          "Helvetica",
          "sans-serif"
        ],
        "unit": null,
        "tolerance": null
      },
      "applies_to": {},
      "verification": "automated",
      "phases": [
        "live"
      ],
      "level": "required",
      "source_ids": [
        "nature-panels"
      ],
      "description": "Use a standard sans-serif font such as Arial or Helvetica.",
      "expression": null,
      "supersedes": [],
      "rationale": null
    },
    {
      "id": "font.size.min",
      "probe": "font.size.min_pt",
      "constraint": {
        "operator": "gte",
        "value": 5,
        "unit": "pt",
        "tolerance": null
      },
      "applies_to": {},
      "verification": "automated",
      "phases": [
        "live"
      ],
      "level": "required",
      "source_ids": [
        "nature-panels"
      ],
      "description": "Minimum text size at final output size.",
      "expression": null,
      "supersedes": [],
      "rationale": null
    },
    {
      "id": "font.size.max",
      "probe": "font.size.max_pt",
      "constraint": {
        "operator": "lte",
        "value": 7,
        "unit": "pt",
        "tolerance": null
      },
      "applies_to": {},
      "verification": "automated",
      "phases": [
        "live"
      ],
      "level": "required",
      "source_ids": [
        "nature-panels"
      ],
      "description": "Maximum text size at final output size.",
      "expression": null,
      "supersedes": [],
      "rationale": null
    },
    {
      "id": "font.size.target",
      "probe": "font.size.max_pt",
      "constraint": {
        "operator": "eq",
        "value": 7,
        "unit": "pt",
        "tolerance": null
      },
      "applies_to": {},
      "verification": "automated",
      "phases": [
        "live"
      ],
      "level": "recommended",
      "source_ids": [
        "nature-panels"
      ],
      "description": "Default to the upper end of Nature's permitted range.",
      "expression": null,
      "supersedes": [],
      "rationale": null
    },
    {
      "id": "line.width.min",
      "probe": "line.width.min_pt",
      "constraint": {
        "operator": "gte",
        "value": 0.25,
        "unit": "pt",
        "tolerance": null
      },
      "applies_to": {},
      "verification": "automated",
      "phases": [
        "live"
      ],
      "level": "required",
      "source_ids": [
        "nature-panels"
      ],
      "description": "Lines thinner than this can disappear in print.",
      "expression": null,
      "supersedes": [],
      "rationale": null
    },
    {
      "id": "figure.title.prohibited",
      "probe": "figure.has_title",
      "constraint": {
        "operator": "eq",
        "value": false,
        "unit": null,
        "tolerance": null
      },
      "applies_to": {},
      "verification": "automated",
      "phases": [
        "live"
      ],
      "level": "recommended",
      "source_ids": [
        "nature-panels"
      ],
      "description": "Keep explanatory titles in the figure legend rather than the artwork.",
      "expression": null,
      "supersedes": [],
      "rationale": null
    },
    {
      "id": "font.pdf.type3.prohibited",
      "probe": "pdf.type3_font_count",
      "constraint": {
        "operator": "eq",
        "value": 0,
        "unit": null,
        "tolerance": null
      },
      "applies_to": {
        "output_formats": [
          "pdf"
        ]
      },
      "verification": "automated",
      "phases": [
        "file"
      ],
      "level": "required",
      "source_ids": [
        "nature-panels"
      ],
      "description": "Text must remain editable rather than using Type 3 glyphs.",
      "expression": null,
      "supersedes": [],
      "rationale": null
    },
    {
      "id": "font.pdf.embedding.required",
      "probe": "pdf.unembedded_font_count",
      "constraint": {
        "operator": "eq",
        "value": 0,
        "unit": null,
        "tolerance": null
      },
      "applies_to": {
        "output_formats": [
          "pdf"
        ]
      },
      "verification": "automated",
      "phases": [
        "file"
      ],
      "level": "required",
      "source_ids": [
        "nature-panels"
      ],
      "description": "All fonts in PDF artwork must be embedded.",
      "expression": null,
      "supersedes": [],
      "rationale": null
    },
    {
      "id": "export.formats.vector",
      "probe": "artifact.format",
      "constraint": {
        "operator": "in",
        "value": [
          "pdf",
          "eps",
          "svg"
        ],
        "unit": null,
        "tolerance": null
      },
      "applies_to": {
        "content_kinds": [
          "data_visualization",
          "line_art"
        ]
      },
      "verification": "automated",
      "phases": [
        "file"
      ],
      "level": "required",
      "source_ids": [
        "nature-panels"
      ],
      "description": "Use one of Nature's supported vector file formats for data visualizations and line art.",
      "expression": null,
      "supersedes": [],
      "rationale": null
    },
    {
      "id": "export.formats.halftone",
      "probe": "artifact.format",
      "constraint": {
        "operator": "in",
        "value": [
          "jpeg",
          "tiff"
        ],
        "unit": null,
        "tolerance": null
      },
      "applies_to": {
        "content_kinds": [
          "halftone",
          "photograph"
        ]
      },
      "verification": "automated",
      "phases": [
        "file"
      ],
      "level": "recommended",
      "source_ids": [
        "nature-panels"
      ],
      "description": "Raster formats apply to Extended Data and image-based content.",
      "expression": null,
      "supersedes": [],
      "rationale": null
    },
    {
      "id": "export.min_dpi.halftone",
      "probe": "artifact.dpi",
      "constraint": {
        "operator": "gte",
        "value": 300,
        "unit": "dpi",
        "tolerance": null
      },
      "applies_to": {
        "output_formats": [
          "png",
          "jpeg",
          "tiff"
        ],
        "content_kinds": [
          "halftone",
          "photograph"
        ]
      },
      "verification": "automated",
      "phases": [
        "file"
      ],
      "level": "recommended",
      "source_ids": [
        "nature-panels"
      ],
      "description": "Extended Data images should be supplied at up to 300 DPI.",
      "expression": null,
      "supersedes": [],
      "rationale": null
    }
  ],
  "namespace": "researchplot",
  "status": "verified",
  "license": "MIT",
  "maintainers": [
    "Devrajsinh Jhala"
  ],
  "extends": [],
  "governance": {
    "policy": "researchplot-governance-v1",
    "reviewers": [
      "Devrajsinh Jhala"
    ],
    "reviewed_on": "2026-08-02",
    "change_note": "Migrated to schema v3 without changing venue rules."
  }
}
